,,,,
1995,医療法人 岸川医院,大阪府東大阪市長堂1－9－18,https://kishikawa-iin.jp/,
1996,アエラクリニック 神戸院,兵庫県神戸市中央区加納町4-3-14 高木ビル3F,https://aera-cl.com/clinic/index.html#kobe,
1997,東京レオンクリニック 神戸院,兵庫県神戸市中央区加納町6-6-3 摩耶松本ビル6階,https://www.leon-cl.com/clinic/kobe/,
1998,神戸メディカルクリニック,兵庫県神戸市中央区加納町3-2-1 IOCビル5F,,
1999,アンチエイジングラボ神戸-高橋整形外科,兵庫県神戸市中央区下山手通9丁目1-5 大倉山イーストビル2F・3F,https://www.takahashi-seikeigeka.com/,
2000,トアロード形成美容クリニック,兵庫県神戸市中央区北長狭通3−12−15 ゴールドウッズトアロードビル５Ｆ,https://tor-cl.jp/,
2001,ソノクリニック 神戸院,兵庫県神戸市中央区三宮町2-11-13F-312 センタープラザ西館3階,https://www.21vin.com/access_kobe/,
2002,神戸中央クリニック美容外科,兵庫県神戸市中央区三宮町1-3-15 京町筋安田ビル6F,https://kobe-beauty.jp/,
2003,品川スキンクリニック神戸院（※品川美容外科提携）,兵庫県神戸市中央区三宮町1-2-1 三神ビル5F,https://shinagawa-skin.com/clinic/kobe/,
2004,びえなクリニック,兵庫県神戸市中央区三宮町3丁目9-19 イトウビル６F,https://biena.jp/,
2005,神戸ルミナスクリニック,兵庫県神戸市中央区三宮町1-4-15 建成ビル 5階,https://www.kobeluminousclinic.jp/,
2006,柴田美容皮膚科クリニック,兵庫県神戸市中央区三宮町1-8-1 サンプラザ3F,https://www.slca-kobe.jp/,
2007,ウラ川クリニック,兵庫県神戸市中央区三宮町3-9-15,,
2008,神戸山手クリニック,兵庫県神戸市中央区三宮町1-4-4 木口ビル5F,https://www.webyamate.com/,
2010,神戸メルクリニック,兵庫県神戸市中央区京町74番地 ダヴィンチ三宮ビル5F,https://mer-clinic.com/,
2011,山本可菜子皮フ科クリニック 神戸元町院,兵庫県神戸市中央区明石町32番地 明海ビル7F,https://kanako-clinic.com/,
2012,ヤマウチクリニック,兵庫県神戸市中央区筒井町3丁目12-7 フィオーレピーア1階 春日野道商店街内,https://www.ycl.ne.jp/,
2013,ルネッサンス美容外科医院 神戸院,兵庫県神戸市中央区八幡通3丁目1-14 サンシポートビル８F,https://www.renaissance-biyougeka.com/about/kobe,"【丁寧なカウンセリング♡】 術式や術後の経過について詳しく説明。納得して施術に臨めるようしっかりサポート
【二重施術・くぼみ目はお任せ！】 解剖学の知識を活かした独自手法で「目を開けても閉じても」自然な二重を実現
【交通費補助制度あり♪】 学割や誕生日割のほかに交通費補助サービスも♡遠方でも受診しやすい！"
2014,こうべ花時計クリニック,兵庫県神戸市中央区磯上通8-3-10 井門三宮ビル8F,https://www.kobe-hanadokei.com/,
2015,西記念 神戸アカデミアクリニック,兵庫県神戸市中央区磯上通3丁目1-13,https://www.kobe-academia.com/,
2016,湘南美容クリニック 神戸院,兵庫県神戸市中央区御幸通6丁目1-10 オリックス神戸三宮ビル5階,https://www.s-b-c.net/clinic/branch/kobe/,
2018,東京スカイクリニック 神戸･三宮院,兵庫県神戸市中央区琴ノ緒町5-3-5 グリーンシャポービル201,https://www.skyclinic.co.jp/,
2019,杉本美容形成外科,兵庫県神戸市中央区琴ノ緒町5-4-10,https://sugimoto-biyou.jp/,
2020,神成（こうせい）美容外科,兵庫県神戸市中央区雲井通7-1-1 ミント神戸 13階,https://biyou-kousei.jp/,
2021,こやまクリニック 形成外科・美容センター,兵庫県神戸市北区山田町下谷上字梅木谷42-4,https://www.hmk-clinic.com/biyou/,
2022,カトレアクリニック,兵庫県神戸市西区南別府2丁目15-9 カトレア総合医療ビル4F,https://www.katoreaclinic.org/,
2023,美紀皮膚科医院,兵庫県神戸市須磨区行幸町4-2-32F,https://www.mikihifuka.jp/,
2024,さわこ形成外科クリニック,兵庫県神戸市東灘区御影中町1-16-20 ポラリス御影3F,https://sawakoclinic.com/,
2025,姫路さくらクリニック,兵庫県姫路市東今宿3-5-8 スカイビル3F,https://himejisakura.com/index.php,
2026,城本クリニック 姫路院,兵庫県姫路市白銀町20 しらさぎビル 7F,https://www.shiromoto.to/clinic/himeji/,"【医師・看護師の有資格者が直接対応◎】 日本形成外科学会認定形成外科専門医と日本美容外科学会（JSAS・JSAPS）認定美容外科専門医が多数在籍！充分なカウンセリング・アドバイス・しっかりしたアフターケアシステムの体制を整え、安心感を追求！
【全国25院｜35年以上の歴史と実績◎】 1988年開院｜全国に25院を展開し、35年以上にわたり美容医療をご提供しております。医療従事者として患者様を第一に考える美容外科。医療機器や薬剤の安全性も重視！
【初診料・カウンセリング料0円♡】 患者さんが何を求め、何を必要としているかをしっかりとヒアリング◎どんな些細なことでも構いません。まずはカウンセリングにて悩みをお聞かせください！"
2027,東京ノーストクリニック 姫路院,兵庫県姫路市立町77 三輪ビル２Ｆ,https://tokyonorstclinic.com/,
2028,きぬがさクリニック 姫路院,兵庫県姫路市駅前町254 姫路OSビル5F,https://www.kinugasaclinic-japan.com/clinic_himeji/,
2029,小国病院 形成外科,兵庫県姫路市南条2丁目23番地,https://www.oguni-hp.com/,
2030,(閉院) ジョウクリニック 姫路院,兵庫県姫路市南駅前町96-1 サウスワンビル4F,https://www.joeclinic.jp/joe_himeji/,
2031,姫路メディカルクリニック,兵庫県姫路市飾磨区構2-147,https://himeji-biyou.com/,
2033,KOSHOクリニック 本館,兵庫県西宮市羽衣町5-13 ワジュール夙川ビル1・2・3F,https://www.koshoclinic.com/,
2034,山王クリニック,兵庫県西宮市羽衣町5-33,https://www.sannoclinic.com/,
2035,斎藤皮フ科クリニック,兵庫県西宮市南越木岩町10-25,https://www.saito-hifuka.com/,
2036,ザ・ニシキタクリニック CHRIS,兵庫県西宮市甲風園1-5-11 フォーカスアレイビル 3F,https://nishikitaclinic.com/,
2037,アーティスクリニック 西宮,兵庫県西宮市松原町4-1 西宮ステーションビル 6F,https://artis-clinic.com/,【二重術LS法◎他院修正や抜糸も】 腫れと痛みにこだわった独自の二重術「LS法」に注目！施術は20年以上の実績を持つ濱田医師が行い患者様の理想を実現。余計な施術はお勧めせず、明朗会計で追加料金なし！
2038,メディカルアーバンクリニック香櫨園,兵庫県西宮市市庭町9-12 香櫨園 メディカルモール3階,,
2040,芦屋柿本クリニック,兵庫県芦屋市春日町24-8ゲマインシャフト芦屋2階,https://ashiya-kakimotoclinic.com/,
2041,カトレア歯科・美容クリニック,大阪府大阪市北区梅田1-12-6 E-ma(イーマ)6階,https://www.cattleya-clinic.jp/,
2042,芦屋ベンクリニック,兵庫県芦屋市船戸町3-23 芦屋三祐ビル2階,https://www.ben-clinic.net/,【素敵に年齢を重ねるための医療ケア】 【JR芦屋駅徒歩約3分・土曜日診療】開院20年、形成外科のプロフェッショナルである院長がお悩みを伺い、一人ひとりに合うオーダーメイド施術をご提案！術後のケアまでトータルサポート◎
2043,芦屋美容クリニック 芦屋院,兵庫県芦屋市東芦屋町1-20,https://ashiya-biyou.com/,【美容のトータルクリニック】 「美容医療で医学的に美しく」「エステティックで気持ち良く美しく」「ヨガやジムなどのスタジオで爽快に美しく」の3ステップで健康的な美しさを叶える新しいスタイルのトータルクリニック！
2045,サカネクリニック,兵庫県加古川市平岡町一色西2-201,https://sakane-clinic.or.jp/,
2046,かんき皮膚科,兵庫県加古川市別府町緑町1番地 多木ビルディング4階,https://xn--u9j524h11a11ykfp17lvues4r.com/,
2047,塩崎クリニック,東京都中野区鷺宮2-5-7,,
2048,林皮膚科クリニック,奈良県奈良市芝辻町２丁目１０－２６－１０２ 新田村ビル１階,https://www3.kcn.ne.jp/~dhayashi/,
2049,えいご皮フ科 奈良,奈良県奈良市三条本町1-2 JR奈良駅NKビル3F,https://hifuka-eigo.com/nara/,
2050,樹のひかり 形成外科・皮ふ科,奈良県奈良市小西町25-1 奈良テラス2F,https://kinohikari.com/,
2051,中谷皮フ科,奈良県奈良市杉ヶ町１２－４,https://www.mahoroba.ne.jp/~shuzo/index.html,
2052,ウエダ形成外科・美容外科クリニック,奈良県奈良市学園北1丁目9-1 パラディ南館 5F,https://www.gakuenmae-clinic.com/,
2053,はもり皮フ科 形成・美容外科,奈良県奈良市学園大和町1丁目1438-1,https://www.hamorihihuka.jp/,
2054,山田胃腸科・肛門科,奈良県奈良市鳥見町1-1-1,https://web1.kcn.jp/y-ichou/,
2055,やなせ皮ふ科,奈良県奈良市西大寺東町2-1-55 丸和西大寺ビル４F,https://nttbj.itp.ne.jp/0742332338/index.html#basic,
2056,ピュアクリニック 西大寺院,奈良県奈良市西大寺南町5-29 大和西大寺駅前第2ビル 4階,https://www.pure-clinic.com/,【創立20周年！理想の美をお手伝い】 経験豊富な医師がご満足いく仕上がりになるように、適した施術をご提案！麻酔や痛み止めなど痛みにも配慮◎「大切な家族や友人にもすすめたい」と思っていただけるような継続率の高い信頼できるクリニックを目指す。
2057,くにしげクリニック,奈良県奈良市菅原町１９６-２,https://www.kunisige.com/index.html,
2058,きのした皮フ科,奈良県橿原市木原町213-7,https://www.kinoshita-clinic.jp/hhifuka.html,
2059,ダイアナクリニック,奈良県橿原市久米町664-1 神宮駅前ビル3階,,
2060,ピュアクリニック イオンモール橿原院,奈良県橿原市曲川町7-20-1 イオンモール橿原 2F,https://www.pure-clinic.com/,【創立20周年！理想の美をお手伝い】 経験豊富な医師がご満足いく仕上がりになるように、適した施術をご提案！麻酔や痛み止めなど痛みにも配慮◎「大切な家族や友人にもすすめたい」と思っていただけるような継続率の高い信頼できるクリニックを目指す。
2061,飯岡形成外科・皮膚科,奈良県桜井市栗殿1019-6,https://www.iioka-clinic.com/,
2062,皮フ科大野クリニック,奈良県桜井市桜井721-5,https://www.hifu-oh33.com/,
2063,皮膚科生駒熊本クリニック,奈良県生駒市俵口町1085-1 生駒メディカルビル1F,https://www.hifu-ikomakuma.com/,
2064,生駒吉岡皮膚科医院,奈良県生駒市西松ヶ丘1-43 ナビールSANWA201,https://yoshiokahifuka-ikoma.jp/,
2065,山本スキンクリニック,奈良県生駒市山崎町4-5 NDAビル2階,https://www.yamamoto-skinclinic.com/,
2066,はとこ形成外科皮膚科クリニック,奈良県香芝市別所３－５,https://www.hatoko-clinic.jp/,
2067,新名クリニック,奈良県香芝市瓦口2288 セイワビル1階,https://www.shimmyo.dr-clinic.jp/shisetu.html,
2068,てらかたクリニック,奈良県田原本町薬王寺３４４－１,https://www.eonet.ne.jp/~momotan/,
2069,ピュアメディカルクリニック 王寺駅前院,奈良県王寺町王寺2-10-1 OSビル4階,https://www.pure-clinic.com/,
2070,リナブレスト・ウイメンズクリニック,奈良県北葛城郡王寺町久度2-13-7みりおんビル1F,,
2071,山下皮膚科クリニック,奈良県河合町西山台525-1,https://www.yamashitacl.com/,
2072,元寺町クリニック,和歌山県和歌山市元寺町1丁目32 元寺町ビル5F,https://www.motoderamachi.com/,
2073,アクアクリニック 和歌山院,和歌山県和歌山市美園町5丁目1-8 山栄ビル7F,,
2074,宮崎クリニック,和歌山県和歌山市友田町2-153 SESSAビル2F,https://www.nnc.or.jp/~miyazaki/,
2075,にしばた形成外科クリニック,和歌山県和歌山市新堀東2-1-15,https://cnishibata.com/,
2076,上出皮フ科クリニック,和歌山県和歌山市西高松1丁目５－５０,https://www.uede-hifuka-clinic.com/index.html,
2077,トメモリ眼科・形成外科,和歌山県橋本市市脇5-4-23,https://www.tomemori-ganka.com/,
2078,小幡医院,和歌山県田辺市湊725-3,https://www.obata-c.net/,
2079,うえおく皮ふ科,和歌山県紀の川市貴志川町長原435-1,https://www.dc-ueoku.jp/pc/index.html,
2080,小溝クリニック,和歌山県印南町1163-11,https://www.komizoclinic.com/,
2081,葉狩皮膚科クリニック,鳥取県鳥取市今町1丁目502番地,https://www.hagari.jp/,
2082,アエラクリニック 米子院,鳥取県米子市茶町60-1 フラワーランドビル3F,https://aera-cl.com/clinic/index.html#yonago,
2083,井上クリニック,鳥取県米子市東町138番地,https://www.geocities.jp/inoueclinic2006/,
2084,しみず皮膚科医院,鳥取県米子市角盤町4-23,https://www.chukai.ne.jp/~shimizu-hifuka/,
2085,KAZUKIプライベートクリニック 米子院,鳥取県米子市中町14-2 水野ビル2階,https://kazuki-pc.com/,
2087,KAZUKIプライベートクリニック 松江院,島根県松江市朝日町484-13 三洋苑第二ビル５階,https://www.kazuki-pc.com/clinic/index.html#matsue,
2088,たかお皮フ科クリニック,島根県松江市新雑賀町4-17,https://www.takaohifuka.com/,
2089,かじクリニック,島根県松江市殿町516 山陰鴻池ビル2F,https://www.myclinic.ne.jp/kaji_clinic/pc/,
2090,みはら眼科皮膚科,島根県出雲市今市町315,https://izumo-mihara.jp/,
2091,とうぎ皮膚科クリニック,島根県出雲市大津新崎1丁目21番,https://tohgi-dm.com/,
2092,赤木皮膚科医院,岡山県岡山市北区岩田町７－８,https://www.akahihu.server-shared.com/,
2093,ももスキンケアクリニック,岡山県岡山市北区駅前町1-8-5 ドレミの街6F,https://momo-scc.jp/index,
2094,恵比寿ガーデンクリニック 岡山院,岡山県岡山市北区駅前町1-8-1,,
2095,城本クリニック 岡山院,岡山県岡山市北区駅元町30-3 カサ･セグーラ 2F,https://www.shiromoto.to/clinic/okayama/,"【医師・看護師の有資格者が直接対応◎】 日本形成外科学会認定形成外科専門医と日本美容外科学会（JSAS・JSAPS）認定美容外科専門医が多数在籍！充分なカウンセリング・アドバイス・しっかりしたアフターケアシステムの体制を整え、安心感を追求！
【全国25院｜35年以上の歴史と実績◎】 1988年開院｜全国に25院を展開し、35年以上にわたり美容医療をご提供しております。医療従事者として患者様を第一に考える美容外科。医療機器や薬剤の安全性も重視！
【初診料・カウンセリング料0円♡】 患者さんが何を求め、何を必要としているかをしっかりとヒアリング◎どんな些細なことでも構いません。まずはカウンセリングにて悩みをお聞かせください！"
2096,かばしまクリニック,岡山県岡山市北区駅元町1-4 ターミナル スクエアビル9F,https://www.kabacli.com/index.php,
2097,岡山中央クリニック,岡山県岡山市北区奉還町1丁目2-1 MKビル1F,https://www.c-kirei.jp/,
2098,服部皮膚科アレルギー科,岡山県岡山市北区清心町3-24,https://hattori-hifu.com/,
2099,まつい皮ふ科,岡山県岡山市北区野殿東町1-35 MAK岡山クリニックモール１階,https://www.matsui-clinic.com/,
2100,東京ノーストクリニック 岡山院,岡山県岡山市北区表町1-10-52 表町アルバビル4F,https://tokyonorstclinic.com/,
2101,このはな皮膚科医院,岡山県岡山市北区岡町1-23,https://www.konohana-hifuka.info/,
2102,共立美容外科 岡山院,岡山県岡山市北区本町6-36 第一セントラルビル6F,https://www.kyoritsu-biyo.com/clinic/okayama,"【経験豊富な医師が丁寧にカウンセリング】 日本美容外科医師会認定の医療機関。保険診療の外科や麻酔科で経験豊富な医師のみ在籍！技術力のあるベテラン医師が時間をかけて真摯にカウンセリングを行うため、初心者でも安心感◎
【目立ちにくい・痛みに配慮した二重整形】 麻酔にもこだわり、痛みや腫れに配慮した共立式P-PL挙筋法！極細の糸を使用し、結び目をまぶたの中に隠すことができるので目立ちにくい◎オプションで34Gの極細針もご用意
【豊富な症例数のある自然な豊胸術】 柔らかく自然・バレにくさを追求した豊胸術。患者様のご要望に合わせてシリコンバッグ・脂肪注入から選択可能！"
2103,湘南美容クリニック 岡山院,岡山県岡山市北区本町6‐30 第一セントラルビル2号館7階,https://www.s-b-c.net/clinic/branch/okayama/,
2104,本田ヒルズタワークリニック 岡山院,岡山県岡山市北区本町1-18 駅前ビル3Ｆ,https://www.xn--0ck4byd809yuwo.com/,
2105,ウィメンズクリニック・かみむら,岡山県岡山市北区本町４－１８ コア本町３F,https://www.wck-ok.jp/,
2106,品川スキンクリニック岡山院,岡山県岡山市北区錦町6-1 両備ビル5F,https://shinagawa-skin.com/clinic/okayama/,
2107,(閉院) 品川美容外科 岡山院,岡山県岡山市北区錦町6-1 両備ビル4F,https://t.afi-b.com/visit.php?guid=ON&a=l303s-K258311t&p=L620469c,
2108,医療法人河田外科形成外科,岡山県岡山市北区幸町4-12 河田ビル１F ２F,https://www.kawada-keisei.gr.jp/,
2109,ふじもと皮ふ科,岡山県岡山市南区泉田316-1,https://fujimoto5705.byoinnavi.jp/pc/,
2110,うちだ皮膚科眼科クリニック,岡山県岡山市南区新保1611-12-1,https://www.uchidaclinic.jp/,
2111,ｇｄｍクリニック,岡山県岡山市北区下中野356 101スプレンドーレ下中野1階A,https://www.gdm-clinic.com/,
2112,つねみつ皮ふ科,岡山県岡山市北区一宮84-20,https://www.megaegg.ne.jp/~tunehifu/,
2113,城東外科医院,徳島県徳島市福島1丁目6-58,,
2114,リラクゼーション マッサージサロン Oasis おあしす,岡山県岡山市中区国富1-17-81Ｆ,https://oasis-massage.net/,
2115,西川原皮膚科,岡山県岡山市中区西川原72-3,https://i-nsc.com/,
2116,河内山皮膚科形成外科,岡山県岡山市東区目黒町10-3,https://www.kouchiyama.or.jp/,
2117,平島クリニック,岡山県岡山市東区東平島１０４１－４,https://www.hirajima-clinic.jp/,
2118,こやまクリニック,岡山県倉敷市黒崎3-1,https://0864633663.jp/index.html,
2119,安田皮フ科クリニック,岡山県倉敷市福島498-2,https://www.yasuda-derma.jp/,
2121,ほう皮フ科クリニック,岡山県倉敷市浜ノ茶屋３１２－９,https://www.hou-hifuka.com/,
2122,倉橋皮フ科クリニック,岡山県倉敷市白楽町150-8,https://www.kurahashi-hifuka.com/,
2123,倉敷平成病院 総合美容センター,岡山県倉敷市老松町4-3-38 倉敷平成病院,https://www.heisei.or.jp/beauty/,
2124,茶屋町駅前クリニック,岡山県倉敷市茶屋町233-21F,https://www.myclinic.ne.jp/cekimae/pc/,
2125,水田皮膚科・泌尿器科,岡山県津山市南新座105,https://www.hakueikai-biyou.com/,
2126,ビュークリニック桃の里,岡山県玉野市八浜町大崎487-22,https://www.momonosato.or.jp/,
2127,菊池クリニック,岡山県美作市入田225-1,https://www.r-kikuchi.jp/,
2128,医療法人天佑会木田医院,岡山県美作市中山1482-3,https://kidaiin.biz/,
2129,心石形成外科,広島県広島市中区基町6-27 広島センタービル9F,https://www.kokoroishi.jp/index.htm,
2130,くろせ皮フ科,広島県広島市中区基町6-27-8F,https://www.kurose-hifuka.or.jp/,
2131,湘南美容クリニック 広島院,広島県広島市中区八丁堀16-3 広島第一ビル6F,https://www.s-b-c.net/clinic/branch/hiroshima/,
2132,東京スカイクリニック 広島･八丁堀院,広島県広島市中区八丁堀6-3 和光八丁堀ビル2F,https://www.skyclinic.co.jp/,
2133,岡山形成外科,広島県広島市中区八丁堀11-18 八丁堀坪井ビル4F,https://www.okayamakeisei.com/,
2134,さくら美容クリニック,広島県広島市中区幟町14-14 広島教販ビル4F,https://sakurabiyou.com/,
2135,沼田皮膚科クリニック,広島県広島市中区幟町13-4 広島マツダビル2F,https://www.numata-hifuka.or.jp/,
2136,広島プルミエクリニック,広島県広島市中区本通り7-29 アイビービル4階,https://hiroshima-biyou.com/,"【女性医師のみ在籍クリニック】 患者様ひとりひとりに寄り添い、女性ならではのお悩みもしっかりサポート。
【形成外科専門医在籍】 院長は形成外科医として20年以上の診療経験あり。
【広島10年以上の歴史、地域に寄り添った美容を。】 安心できる空間・施術をご提供するために、日々患者様にあわせた進化を目指します。"
2137,すず美容形成外科医院,広島県広島市中区鉄砲町10-13 八丁堀伊藤久芳堂ビル6F,https://www.suzu-clinic.com/,"【岩垂院長は形成外科のエキスパート】 繊細さを必要とする施術もお任せ！気さくで丁寧な人柄でどんな悩みも相談しやすい
【広島電鉄「八丁堀」から徒歩1分】 皮膚科メニューも豊富にご用意！お買い物ついでにお肌のケアもできちゃう♪
【自然で可愛い目元施術に注力♡】 デザインに一切の妥協なし！筋肉や脂肪のつき方まで考慮して納得の仕上がりに"
2138,大山皮ふ科クリニック,広島県広島市中区鉄砲町3-1,https://www.e-ohada.net/,
2139,ラミュー広島中央クリニック,広島県広島市中区三川町2-3 INGビル2階,https://www.chuoh-clinic-hiroshima.com/,
2140,並木Ｓクリニック,広島県広島市中区三川町5-11,https://namiki-clinic.com/,
2141,だいこく皮ふ科・アレルギー科,広島県広島市中区三川町1-20 ピンクリボン39ビル 3F,https://www.daikokuhifuka.jp/,
2142,品川スキンクリニック広島院,広島県広島市中区紙屋町2-2-2 紙屋町ビル5F,https://shinagawa-skin.com/clinic/hiroshima/,
2143,聖心美容クリニック 広島院,広島県広島市中区本通3番10号 本通サザン6F,https://www.hiroshimain.com/,"【美的センスと技術力を持つ医師陣】 経験豊富な医師が集い、外科・皮膚科・内科・再生医療といった多岐にわたるご提案が可能！施術ごとに無料保証を設定し、もしもの不安にも寄り添う♡
【二重埋没や切開も◎目元施術に注力】 目元の症例多数！一人ひとりのご要望としっかり向き合い、それぞれの良さを引き出して理想を叶える♪
【鼻尖形成や小鼻縮小などの鼻施術も◯】 安心感ある丁寧なカウンセリング♪希望部位を撮影＆シミュレーション画像で丁寧にすり合わせ、理想のお鼻に近づける"
2144,NTクリニック広島,広島県広島市中区本通7-29 アイビービル3F,https://nt-clinic.net/,
2145,カルミア美肌クリニック,広島県広島市中区中町2-5 ロアール並木通り3F,https://calmia-clinic.com/,
2146,美容皮膚科エルムクリニック 広島院,広島県広島市中区大手町1丁目4-14 上田ビル5F,https://www.elm-clinic.jp/clinic/hiroshima/,
2147,やまもと美容形成外科,広島県広島市中区大手町3-1-7,https://www.yamamoto-biyo.com/,
2148,さち皮ふ科クリニック,広島県広島市中区大手町5丁目2-22 山陽ビル2号館1階,https://www.sachi-clinic.jp/,
2149,なかの皮ふ科ひ尿器科,広島県広島市中区千田町1丁目3-32F,https://www.nakano-hifuka.com/,
2150,慶友クリニック,広島県広島市中区加古町8-12 勝田ビル2F,,
2151,にいみ皮ふ科アレルギー科,広島県広島市安佐南区川内5丁目31-11,https://www.niimi-hifuka.jp/,
2152,ましの皮ふ科クリニック,広島県広島市安佐南区東原1丁目1-2-4F,https://www.mashino-hifuka.com/,
2153,前田皮ふ科医院,広島県広島市安佐南区上安2丁目4-39 MGビル2F,https://www.maeda-hifuka.com/,
2154,岡野皮ふ科クリニック,広島県広島市安佐北区可部5-14-16 可部中央クリニックビル2F,https://www.citydo.com/prf/hiroshima/guide/sg/450001431.html,
2155,三宅クリニック,広島県広島市佐伯区五日市中央5-1-39,https://www.miyake-clinic.jp/,
2156,高橋泌尿器科・皮ふ科クリニック,広島県広島市東区温品7丁目10-11-18,https://www17.plala.or.jp/ud-takahashi/,
2157,水野皮ふ科,広島県広島市東区若草町11-1-101 JR広島駅新幹線口 ザ・広島タワー1F,https://www.mizuno-hifuka.jp/,
2158,宮本形成外科,広島県広島市南区段原南2-3-22,https://www.keiseigeka.co.jp/,
2159,東京ノーストクリニック 広島院,広島県広島市南区的場町1-7-1 的場ビル３Ｆ,https://tokyonorstclinic.com/,
2160,新広島形成外科,広島県広島市南区京橋町1-3-201,,
